{
  "schema_version": 1,
  "catalog_schema_version": 1,
  "catalog_sha256": "0ffbbae180ef178fdc905acd0c4307b5df661d6823a9ed34303cc6010216785f",
  "selection_sha256": "f2331b66d589a74848c3751723ba2426f037afc878bc5355e6e929c35127f49f",
  "selected_ids": [
    "cgroup.cpu.periods",
    "cgroup.cpu.system",
    "cgroup.cpu.throttled_periods",
    "cgroup.cpu.throttled_time",
    "cgroup.cpu.usage",
    "cgroup.cpu.user",
    "cgroup.faults.major",
    "cgroup.faults.minor",
    "cgroup.io.read",
    "cgroup.io.write",
    "cgroup.memory.current",
    "cgroup.memory.peak",
    "cgroup.pressure.cpu.full",
    "cgroup.pressure.cpu.some",
    "cgroup.pressure.io.full",
    "cgroup.pressure.io.some",
    "cgroup.pressure.memory.full",
    "cgroup.pressure.memory.some",
    "process.cpu.system_time",
    "process.cpu.user_time",
    "process.faults.major",
    "process.faults.minor",
    "process.io.read",
    "process.io.write",
    "process.memory.resident"
  ],
  "mode": "live",
  "sample_interval_ns": 1000000
}
