{
  "schema_version": 1,
  "catalog_schema_version": 1,
  "catalog_sha256": "0ffbbae180ef178fdc905acd0c4307b5df661d6823a9ed34303cc6010216785f",
  "selection_sha256": "8e5a423cbde1fb96baf30e77b7a345894107a6533aca0acd6a2fcbebc848c34a",
  "selected_ids": [],
  "mode": "live",
  "sample_interval_ns": null
}
